タイトル,エリア,レベル
冒険者への手引き,グリダニア,1 
冒険者への手引き,リムサ・ロミンサ,1 
冒険者への手引き,ウルダハ,1 
バノック練兵所へ,グリダニア,4 
サマーフォード庄へ,リムサ・ロミンサ,4 
ウルダハ操車庫へ,ウルダハ,4 
傭兵の身構え,黒衣森：中央森林,5 
不審者を追って,黒衣森：中央森林,5 
猛者の風格,中央ラノシア,5 
シーソング石窟に潜む者,中央ラノシア,5 
美味しい差し入れ,中央ザナラーン,5 
ササガン大王樹の下で,中央ザナラーン,5 
陸にあがった海賊,中央ラノシア,7 
御礼品は予約品,中央ザナラーン,6 
チゴーの卵袋,黒衣森：中央森林,7 
横流し疑惑,中央ラノシア,8 
測量機材を探して,黒衣森：中央森林,8 
戦場の備え,中央ザナラーン,8 
森を脅かすものたち,黒衣森：中央森林,9 
ウォーレン牢獄の影,黒衣森：中央森林,9 
芳しき陸の勇者,中央ラノシア,9 
元海賊を笑う海賊,中央ラノシア,9 
裏切りの代償,中央ラノシア,9 
迷惑な鉱石マニア,中央ザナラーン,9 
成功の表と裏,中央ザナラーン,9 
ベントブランチ牧場への誘い,グリダニア,10 
侵入者に制裁を！,黒衣森：中央森林,10 
スカイリフトへ,リムサ・ロミンサ,10 
ホライズンへ,ウルダハ,10 
宝石商の憂鬱,西ザナラーン,10 
ナナシャマラカイトを取り戻せ！,西ザナラーン,10 
アオツキダケの脅威,黒衣森：中央森林,11 
牧場に忍び寄る影,黒衣森：中央森林,11 
伝令文の回覧,黒衣森：中央森林,11 
すべてを奪われた地,中央ラノシア,11 
ブルワーズ灯台の異変,西ラノシア,11 
モラビー造船廠へ,リムサ・ロミンサ,11 
五月蝿いヤツら,西ザナラーン,11 
貧民街の連隊長,西ザナラーン,11 
飛ぶ魔物の調査,黒衣森：中央森林,12 
帰らぬ造船師,低地ラノシア,12 
消えた造船師,低地ラノシア,12 
その男、サー・キヴロン,中央ザナラーン,12 
受け継がれる護身刀,中央ザナラーン,12 
ひそやかな警鐘,黒衣森：中央森林,13 
取り残された届け物,黒衣森：中央森林,13 
造船廠を刺す眼光,低地ラノシア,13 
足跡の谷へ,西ザナラーン,13 
酒のサカナ求む,西ザナラーン,13 
守るべきぬくもり,黒衣森：中央森林,14 
不穏な報せ,黒衣森：中央森林,14 
大樹で蠢く闇の鼓動,グリダニア,14 
祭りの準備,グリダニア,14 
大御霊祭り,グリダニア,14 
ヴィクトリー号炎上,低地ラノシア,14 
蒼き刺青の男たち,低地ラノシア,14 
スウィフトパーチで蠢く闇,リムサ・ロミンサ,14 
紳士淑女の嗜み,リムサ・ロミンサ,14 
ミズンマストの晩餐会,リムサ・ロミンサ,14 
正義を銅の刃に宿し,西ザナラーン,14 
落日の銀冑団,西ザナラーン,14 
至宝の影で蠢く闇,ウルダハ,14 
晩餐会に備えて,ウルダハ,14 
王宮の晩餐会,ウルダハ,14 
海都と砂都と,グリダニア,15 
森都と砂都と,リムサ・ロミンサ,15 
海都と森都と,ウルダハ,15 
海都で待つ仕事,グリダニア,15 
海都で待つ仕事,ウルダハ,15 
サスタシャに挑む者,リムサ・ロミンサ,15 
森都で待つ仕事,リムサ・ロミンサ,15 
タムタラの仄暗い底で,グリダニア,16 
砂都で待つ仕事,グリダニア,16 
カッパーベルで消える夢,ウルダハ,17 
暁の血盟,ウルダハ,17 
キャンプ・ドライボーンへ,砂の家,17 
干からびた骨,東ザナラーン,17 
貧しき者の考え,東ザナラーン,18 
すがりし光は,東ザナラーン,18 
共謀者の影,東ザナラーン,19 
虚ろな富の行方,東ザナラーン,19 
消えた者たちの行方,東ザナラーン,19 
生命、マテリア、すべての答え,砂の家,19 
猛る焔神イフリート,砂の家,20 
英雄の卵,砂の家,20 
我が行く道は……（双蛇党）,砂の家,20 
我が行く道は……（黒渦団）,砂の家,20 
我が行く道は……（不滅隊）,砂の家,20 
森の意志あらんことを,グリダニア,20 
海が全てを呑み込むまで,リムサ・ロミンサ,20 
富と国のため,ウルダハ,20 
青葉の思惑,砂の家,20 
蜜の道を辿って,グリダニア,20 
変わり者の挨拶,黒衣森：東部森林,20 
魅惑の手土産,黒衣森：東部森林,20 
シルフ族との架け橋,黒衣森：東部森林,21 
挨拶は軽快に,黒衣森：東部森林,21 
仮宿暮らしの困りごと,黒衣森：東部森林,21 
知らないヒト,黒衣森：東部森林,21 
クラクシオの決意,黒衣森：東部森林,22 
ただよえる長老,黒衣森：東部森林,22 
バスカロンドラザーズの掟,黒衣森：南部森林,22 
懐かしき忘れ物,黒衣森：南部森林,23 
テテルンのふるまい酒,高地ラノシア,23 
熟成される友情,高地ラノシア,23 
木立を縫う者,黒衣森：南部森林,23 
犯人をとっちめろ！,黒衣森：南部森林,23 
獄の底から響く声,黒衣森：南部森林,24 
バスカロンの贈り物,黒衣森：南部森林,24 
シルフ族と蛮神ラムウ,黒衣森：東部森林,24 
森からの帰還,グリダニア,24 
不吉な気配,砂の家,24 
橋上の証言,東ザナラーン,24 
陽動の狼煙,東ザナラーン,25 
リトルアラミゴへの旅路,東ザナラーン,25 
よそ者たちの奮闘,南ザナラーン,25 
そこに故郷の形見はあるか,南ザナラーン,25 
アラミゴ解放軍を知る者,砂の家,26 
無慈悲な精霊,黒衣森：南部森林,26 
角薬が繋ぐ縁,黒衣森：南部森林,27 
異邦の絆,黒衣森：南部森林,27 
リトルアラミゴ再び,黒衣森：南部森林,27 
密かな企み,南ザナラーン,27 
ある青年の呼び出し,南ザナラーン,27 
若き血の暴走,南ザナラーン,27 
束の間の帰還,南ザナラーン,27 
浮き村の怪事件,砂の家,27 
採掘場の切り裂き魔,黒衣森：北部森林,28 
怨念岩の謎,黒衣森：北部森林,28 
逢魔が時に光る瞳,黒衣森：北部森林,28 
推理は踊る,黒衣森：北部森林,28 
白百合は謡う,黒衣森：北部森林,28 
ダルタンクール家の悲劇,グリダニア,28 
海都の仇敵,砂の家,30 
タコタン討伐武勇伝,低地ラノシア,30 
それでもタコタン討伐武勇伝,低地ラノシア,30 
怒りの風車番,低地ラノシア,30 
ヴェイスケートの腕試し,東ラノシア,30 
エオルゼアの珍味を求めて,東ラノシア,30 
アダマンタスの大卵,黒衣森：南部森林,30 
ウ族の試練,南ザナラーン,31 
ラムトンウォームの肉,南ザナラーン,31 
思い出の土産酒,南ザナラーン,31 
ブレイフロクスの珍チーズ,東ラノシア,32 
ごちそうには美酒を,東ラノシア,32 
シャマニ・ローマニの求める香り,東ラノシア,32 
失われた伝説を訪ねて,東ラノシア,32 
密林の男,東ラノシア,33 
耳に残るは蟲の音,東ラノシア,33 
友情の木の実,東ラノシア,33 
人の命運、ワインの運命,東ラノシア,33 
永遠なる海雄旅団,東ラノシア,33 
口笛は風に乗り,東ラノシア,33 
憤怒の岩神タイタン,高地ラノシア,34 
灯りの消えた日,高地ラノシア,34 
止まったままの時間,東ザナラーン,35 
静かなる葬送,東ザナラーン,35 
小さな勇者の帰還,東ザナラーン,35 
彼方より来たりて,東ザナラーン,35 
飛空艇エンタープライズの行方,東ザナラーン,36 
あの山を越えて,黒衣森：北部森林,36 
凍てつく大地,クルザス中央高地,36 
デュランデル家の流儀,クルザス中央高地,36 
砦に宛てられた荷物,クルザス中央高地,36 
アインハルト家の受難,クルザス中央高地,36 
四大名家に訊く,クルザス中央高地,37 
潔白の証明,クルザス中央高地,38 
嫌疑の審理,クルザス中央高地,38 
異端は魔女の谷に消ゆ,クルザス中央高地,38 
あの日の空に見たものは,クルザス中央高地,38 
前哨地の歓待,クルザス中央高地,39 
炊事場最前線,クルザス中央高地,39 
野戦病院の蒸留器,クルザス中央高地,39 
審問官ギイェームの横顔,クルザス中央高地,40 
沈黙する真実,クルザス中央高地,40 
吹雪の夜の追想,クルザス中央高地,40 
竜の力、戦いの歴史,クルザス中央高地,40 
ストーンヴィジルに眠る翼,クルザス中央高地,41 
嵐を越える突破口,グリダニア,41 
ハイブリッジの一番弟子,東ザナラーン,41 
バーニングウォールを踏破せよ,東ザナラーン,41 
偏属性クリスタルを求めて,東ザナラーン,41 
船はいまだ港に,西ラノシア,42 
幻影諸島奇談,西ラノシア,42 
島に乗りこめ！,西ラノシア,42 
波間よりいずる者,西ラノシア,42 
狂気の歌声,西ラノシア,42 
最後の偏属性クリスタル,西ラノシア,43 
始動！エンタープライズ,グリダニア,43 
暴虐の嵐神ガルーダ,グリダニア,44 
かすかな灯火,ウルダハ,44 
反攻の布石,砂の家,44 
帝国を見張る目,クルザス中央高地,44 
ふたりの脱走者,クルザス中央高地,44 
ビッグスの捜索,クルザス中央高地,44 
炉には炎を、回せ歯車,クルザス中央高地,44 
モードゥナに集う猛者たち,クルザス中央高地,44 
帝国軍あざむき作戦,モードゥナ,44 
即席の雷波塔,モードゥナ,46 
偽りの敬礼,モードゥナ,46 
帝国兵なりきり装備,モードゥナ,46 
魔導アーマーを奪取せよ！,モードゥナ,46 
魔導兵器のみる夢,モードゥナ,46 
カストルム・セントリからの救出,モードゥナ,46 
エオルゼアの明日のために,ウルダハ,46 
十二賢者の行進,砂の家,49 
決戦の地へと続く道,西ザナラーン,49 
心に火をくべて,北ザナラーン,49 
カストルム・メリディアヌムの死闘,北ザナラーン,50 
究極幻想アルテマウェポン,北ザナラーン,50 
